{
  "spec_id": "bc164a1d-bfb6-4b23-b93b-6ff3175b26ae",
  "title": "Alternative Data Anomaly Detection & Geopolitical Trading System",
  "created_date": "2026-04-03",
  "updated_date": "2026-04-03",
  "version": "3.0",
  "status": "draft",
  "domain": "trading",
  "spec_type": "implementation",
  "sources": [
    {
      "collection": "trading-strategies-v3",
      "item_id": "tweet_2039282251159011513",
      "title": "NASA FIRMS satellite thermal anomaly detection for geopolitical prediction markets. 10-source free data stack, 270-day backtest across Gaza/Kursk/Syria, $500 to $7,778 on 16 trades.",
      "relevance": "Core system blueprint: NASA FIRMS satellite trading with 10-source data stack, anomaly detection algorithm (14-day rolling average, 3x threshold), detected Oct 7 at 11x anomaly, Kursk 4 days early, Assad 3 weeks early. Dynamic Kelly sizing with Claude decision engine. The satellite detection pipeline maps directly to Kalshi political/economics/geopolitical contracts."
    },
    {
      "collection": "trading-strategies-v3",
      "item_id": "tweet_2038608348958834926",
      "title": "Soros-archetype geopolitical information edge: $800K deployed, 93% win rate, CNN investigation.",
      "relevance": "Soros-style geopolitical information edge pattern: Magamyman wallet deploying $800K on military strike predictions with 93% win rate, investigated by CNN and Columbia Law School. The alternative data stack provides a legal, publicly available approximation of this information edge. Cascade detection across correlated markets applies directly to Kalshi political and economics event categories."
    },
    {
      "collection": "trading-strategies-v3",
      "item_id": "tweet_2039479380368408840",
      "title": "Logic arbitrage via causal event chains: exploiting repricing delays between causally linked prediction market contracts.",
      "relevance": "Logic arbitrage exploiting causal dependencies between events before markets reprice downstream consequences. Kalshi's structured event categories (politics, economics, geopolitical) naturally create causal chains across contract types. Speed advantage measured in minutes to hours, not milliseconds."
    },
    {
      "collection": "trading-strategies-v3",
      "item_id": "tweet_2039323712713810150",
      "title": "17K wallet behavioral analysis pipeline: 11 strategy archetypes, edge decay quantification, $8 API cost.",
      "relevance": "Wallet-level behavioral analysis revealing edge decay patterns (BTC lag compression 9.4s to 3.1s), 11 distinct strategies mapped from 17,000 wallets at $8 total cost. Edge decay quantification informs strategy lifecycle management and signal durability assessment on Kalshi."
    },
    {
      "collection": "x_posts",
      "item_id": "2039373347696328738",
      "title": "Autonomous Claude agent: live news mapping, probabilistic inference on mispricing, cross-market arb, Kelly sizing. $25 to $4,237 overnight.",
      "relevance": "Agent architecture reference: autonomous agent that reads live news, maps to open markets, runs probabilistic inference on crowd mispricing, detects cross-market arbitrage, sizes with Kelly. 94 trades autonomous overnight. Architecture pattern applies to Kalshi execution."
    },
    {
      "collection": "x_posts",
      "item_id": "2038622884642398503",
      "title": "14K wallet analysis: 87% lose money, top 0.1% extracted $3.7B. 3 core formulas (EV/Kelly/Bayesian), 12-tool open-source toolkit.",
      "relevance": "Mathematical foundation: EV filtering (skip below 5%), Kelly Criterion (quarter-Kelly always), Bayesian updating. These mathematical primitives are platform-agnostic and apply identically on Kalshi."
    },
    {
      "collection": "x_posts",
      "item_id": "2039308895290581254",
      "title": "5 free GitHub scripts: trading terminal, data recorder, ML model.",
      "relevance": "Infrastructure components: data recorder logging order books and trades simultaneously, trading terminal with Telegram alerts. Data recording methodology applies to Kalshi orderbook data."
    },
    {
      "collection": "x_posts",
      "item_id": "2039055805626937399",
      "title": "Why prediction market bots fail: data completeness > strategy quality. 1,000+ bots built, 1% success rate.",
      "relevance": "Critical design constraint: data completeness is more important than strategy quality. Must record full order book depth, real spreads, actual fill behavior. Minimum 1000 windows for statistical confidence. Perfect execution assumption is fatal."
    }
  ],
  "overview": {
    "description": "An end-to-end autonomous trading system that ingests free alternative data sources (satellite imagery, aircraft tracking, seismic data, financial indicators) to detect geopolitical and real-world anomalies before prediction markets price them in, executing on Kalshi, a CFTC-regulated US event contract exchange. The system is grounded in backtested results: $500 grew to $7,778 across 16 trades (11 wins, 5 losses) over a 270-day backtest period, detecting the Oct 7 Gaza attack as an 11.1x thermal anomaly, the Kursk offensive 4 days before official confirmation, and Assad's fall 3 weeks early via escalating thermal signals. v3.0 integrates four convergent intelligence layers: (1) a multi-source anomaly detection engine using NASA FIRMS thermal data as the primary signal with 9 confirming sources forming a $0/month 10-source free data stack, (2) a Kalshi orderbook intelligence pipeline analyzing order flow patterns and volume anomalies, (3) a logic arbitrage engine that exploits causal event chains across Kalshi's structured contract categories before markets reprice downstream consequences, and (4) a Claude-based decision engine that synthesizes all signals into trade decisions with dynamic Kelly sizing. The Soros-archetype pattern (Magamyman: $800K deployed, 93% win rate on military strike predictions, CNN/Columbia Law School investigated) demonstrates that geopolitical information edges produce outsized returns -- the alternative data stack provides a legal, publicly available approximation of this edge. Edge decay analysis (BTC latency arbitrage compressed from 9.4s to 3.1s) informs strategy lifecycle management: FIRMS satellite data is early in its exploitation lifecycle, but signal durability must be actively monitored. The 4-6 hour FIRMS NRT publication delay constrains execution to swing-style positioning (hours to days), not high-frequency trading, targeting Kalshi contracts with multi-day resolution windows across geopolitics, conflict, sanctions, and military event categories.",
    "objectives": [
      "Detect geopolitical anomalies 1-21 days before Kalshi markets price them in, using the 10-source free data stack anchored by NASA FIRMS satellite thermal data",
      "Maintain a $0/month alternative data pipeline (9 of 10 sources require no API key) running a 40-second full scan cycle every 15 minutes, outperforming $24K/year Bloomberg Terminal for satellite-based conflict detection",
      "Implement the anomaly detection statistical framework: 14-day rolling average baseline with 3x threshold, continuation bias filter (skip when 7-day baseline triples), and Fire Radiative Power (FRP in MW) severity grading",
      "Execute logic arbitrage by mapping causal event chains across Kalshi's structured contract categories (politics -> economics -> geopolitical) and positioning on downstream contracts before market repricing",
      "Map satellite and alternative data anomalies to specific Kalshi event categories: geopolitics (military action, regime change, conflict escalation), politics (sanctions, government policy), economics (CPI, GDP, Fed rate decisions influenced by conflict-driven commodity shocks)",
      "Build a Claude-powered decision engine that cross-references all data sources, reasons about causal chains, estimates true probabilities, and outputs structured trade decisions with ~70% directional accuracy",
      "Apply dynamic Kelly Criterion position sizing scaled by anomaly severity and confirmation count: quarter-Kelly ceiling, producing $41 losses on false alarms vs $470 gains on true signals through position size modulation",
      "Analyze Kalshi orderbook data to detect institutional positioning patterns, volume anomalies, and price dislocations, compensating for the absence of on-chain wallet transparency",
      "Monitor edge decay and signal compression: track exploitation lifecycle of FIRMS satellite edge, assess whether Kalshi's smaller US-only participant base compresses edges slower than larger retail platforms",
      "Execute trades autonomously on Kalshi via REST API with configurable risk limits, achieving the backtested benchmark of positive EV across 16+ trades with 60%+ directional accuracy",
      "Record complete market data (order books, fills, spreads) to enable statistically valid backtesting with minimum 1000 windows per strategy"
    ],
    "constraints": [
      "All data sources must be free ($0/month total cost for the 10-source stack)",
      "NASA FIRMS NRT data has ~3 hour processing delay; URT (Ultra Real-Time) available within ~60 seconds but with less coverage. The 4-6 hour publication delay means swing trading not HFT -- must target Kalshi contracts with multi-day resolution windows",
      "Kalshi political/geopolitical markets may have variable liquidity; position sizes must be capped at 2% of market volume and respect Kalshi per-market position limits. Thinner order books than prior platforms may reduce strategy capacity",
      "Claude API provides ~70% directional accuracy, which dynamic quarter-Kelly sizing must absorb. False alarm cost $41 (small position on weak signal); true signal made $470 (scaled position on strong signal)",
      "Anomaly detection only works for FIRST spikes; continuation signals after baseline tripling must be filtered via the continuation bias mechanism (skip when 7-day baseline itself triples)",